{
  "$schema": "https://json-schema.org/draft/2020-12/schema",
  "$id": "https://api.ever.co/v1/consent/schema/ever.consent.v1",
  "title": "Ever Platform consent record v1",
  "description": "One consent Ever Platform keeps for one integration of one installation (and, for a per-link integration, one tenant link), as GET /v1/orgs/{org}/consents and POST /v1/consents/{consent}/revoke answer it; a product mirrors the same record next to its local integration state. A record is immutable but for its revocation (revoked_at, revoked_by_person_id, revoke_reason, revoke_source, set together). Every member is present; an absent value is null. A person id is shown only to that person (null for another member, a deleted person or a consent under the cloud terms). Evidence never holds an IP address or a user agent.",
  "type": "object",
  "additionalProperties": false,
  "required": [
    "id",
    "org_id",
    "instance_id",
    "tenant_link_id",
    "integration_key",
    "scope_version",
    "dpa_version",
    "terms_version",
    "granted_by_person_id",
    "granted_at",
    "evidence",
    "consent_source",
    "revoked_at",
    "revoked_by_person_id",
    "revoke_reason",
    "revoke_source",
    "supersedes_id"
  ],
  "properties": {
    "id": {
      "$ref": "#/$defs/ulid"
    },
    "org_id": {
      "description": "The organization that consented.",
      "$ref": "#/$defs/ulid"
    },
    "instance_id": {
      "description": "The installation.",
      "$ref": "#/$defs/ulid"
    },
    "tenant_link_id": {
      "description": "The tenant link; null for an installation-wide integration (instance_url, stats_link, ever_id_login, webhooks).",
      "oneOf": [
        {
          "$ref": "#/$defs/ulid"
        },
        {
          "type": "null"
        }
      ]
    },
    "integration_key": {
      "description": "A key of the published integration catalog, or partner:<slug>.",
      "type": "string",
      "maxLength": 74,
      "pattern": "^[a-z][a-z0-9_]{1,40}(:[a-z0-9-]{2,32})?$"
    },
    "scope_version": {
      "description": "The scope version consented to.",
      "type": "integer",
      "minimum": 1,
      "maximum": 2147483647
    },
    "dpa_version": {
      "description": "The version of the one generic data-processing agreement accepted.",
      "type": "string",
      "maxLength": 11,
      "pattern": "^20[0-9]{2}-(0[1-9]|1[0-2])(\\.[0-9]{1,3})?$"
    },
    "terms_version": {
      "description": "The terms version that disclosed the integration (consents under the cloud terms); null otherwise.",
      "oneOf": [
        {
          "$ref": "#/$defs/token64"
        },
        {
          "type": "null"
        }
      ]
    },
    "granted_by_person_id": {
      "description": "Who granted it: the caller's own id when it was the caller, else null.",
      "oneOf": [
        {
          "$ref": "#/$defs/ulid"
        },
        {
          "type": "null"
        }
      ]
    },
    "granted_at": {
      "$ref": "#/$defs/timestamp"
    },
    "evidence": {
      "description": "Where and how it was given; no personal data.",
      "type": "object",
      "additionalProperties": false,
      "properties": {
        "ui": {
          "description": "app.ever.co; cloud_terms (an Ever Cloud link under the terms); staff (an installation Ever operates, set by Ever staff under the terms); product:<product> (a product's own dialog).",
          "type": "string",
          "maxLength": 16,
          "pattern": "^(app\\.ever\\.co|cloud_terms|staff|product:(gauzy|teams|works|rec|traduora|demand))$"
        },
        "screen_version": {
          "type": "string",
          "maxLength": 32,
          "pattern": "^[A-Za-z0-9.:_-]{1,32}$"
        },
        "ui_locale": {
          "type": "string",
          "maxLength": 16,
          "pattern": "^[A-Za-z0-9.:_-]{1,16}$"
        },
        "request_id": {
          "type": "string",
          "maxLength": 128,
          "pattern": "^[A-Za-z0-9.:_-]{1,128}$"
        }
      }
    },
    "consent_source": {
      "description": "app_ever_co: an owner or admin in app.ever.co; cloud_terms: an installation Ever operates, under its terms; product_ui: the product's own consent dialog (not accepted by contract v1).",
      "enum": [
        "app_ever_co",
        "cloud_terms",
        "product_ui"
      ]
    },
    "revoked_at": {
      "oneOf": [
        {
          "$ref": "#/$defs/timestamp"
        },
        {
          "type": "null"
        }
      ]
    },
    "revoked_by_person_id": {
      "description": "Who revoked it: the caller's own id when it was the caller, else null.",
      "oneOf": [
        {
          "$ref": "#/$defs/ulid"
        },
        {
          "type": "null"
        }
      ]
    },
    "revoke_reason": {
      "enum": [
        "owner",
        "superseded",
        "instance",
        "operator",
        "policy",
        "instance_disconnected",
        "link_unlinked",
        "org_deleted",
        "staff",
        null
      ]
    },
    "revoke_source": {
      "description": "Where the revocation came from: owner, superseded, org_deleted and staff are platform; instance, instance_disconnected and link_unlinked are instance; operator; policy.",
      "enum": [
        "platform",
        "instance",
        "operator",
        "policy",
        null
      ]
    },
    "supersedes_id": {
      "description": "The consent this one replaced (a new scope or agreement version).",
      "oneOf": [
        {
          "$ref": "#/$defs/ulid"
        },
        {
          "type": "null"
        }
      ]
    }
  },
  "allOf": [
    {
      "description": "A revocation sets revoked_at, revoke_reason and revoke_source together.",
      "if": {
        "type": "object",
        "properties": {
          "revoked_at": {
            "type": "null"
          }
        }
      },
      "then": {
        "type": "object",
        "properties": {
          "revoke_reason": {
            "const": null
          },
          "revoke_source": {
            "const": null
          },
          "revoked_by_person_id": {
            "type": "null"
          }
        }
      },
      "else": {
        "type": "object",
        "properties": {
          "revoke_reason": {
            "type": "string"
          },
          "revoke_source": {
            "type": "string"
          }
        }
      }
    },
    {
      "description": "Under the cloud terms nobody granted it in person, a terms version is recorded, and the evidence says whether a link was materialised under them (cloud_terms) or Ever staff set an installation Ever operates (staff).",
      "if": {
        "type": "object",
        "properties": {
          "consent_source": {
            "const": "cloud_terms"
          }
        }
      },
      "then": {
        "type": "object",
        "required": [
          "evidence"
        ],
        "properties": {
          "granted_by_person_id": {
            "type": "null"
          },
          "terms_version": {
            "type": "string"
          },
          "evidence": {
            "type": "object",
            "required": [
              "ui"
            ],
            "properties": {
              "ui": {
                "enum": [
                  "cloud_terms",
                  "staff"
                ]
              }
            }
          }
        }
      }
    },
    {
      "if": {
        "type": "object",
        "properties": {
          "consent_source": {
            "const": "app_ever_co"
          }
        }
      },
      "then": {
        "type": "object",
        "properties": {
          "evidence": {
            "type": "object",
            "required": [
              "ui"
            ],
            "properties": {
              "ui": {
                "const": "app.ever.co"
              }
            }
          }
        }
      }
    },
    {
      "description": "A product's own dialog never enables counterparty_discoverable or instance_url, which are enabled in app.ever.co only.",
      "if": {
        "type": "object",
        "properties": {
          "consent_source": {
            "const": "product_ui"
          }
        }
      },
      "then": {
        "type": "object",
        "properties": {
          "integration_key": {
            "type": "string",
            "pattern": "^(?!(?:counterparty_discoverable|instance_url)$)"
          },
          "evidence": {
            "type": "object",
            "required": [
              "ui"
            ],
            "properties": {
              "ui": {
                "type": "string",
                "pattern": "^product:"
              }
            }
          }
        }
      }
    }
  ],
  "$defs": {
    "ulid": {
      "type": "string",
      "maxLength": 26,
      "pattern": "^[0-9A-HJKMNP-TV-Z]{26}$"
    },
    "timestamp": {
      "description": "An RFC 3339 time in UTC with an optional fraction.",
      "type": "string",
      "maxLength": 30,
      "pattern": "^[0-9]{4}-[0-9]{2}-[0-9]{2}T[0-9]{2}:[0-9]{2}:[0-9]{2}(\\.[0-9]{1,9})?Z$"
    },
    "token64": {
      "type": "string",
      "maxLength": 64,
      "pattern": "^[A-Za-z0-9._-]{1,64}$"
    }
  }
}
